#
# COUNT(DISTINCT) PQ lifecycle coverage.
#
SET @save_parallel_max_threads= @@global.parallel_max_threads;
SET @save_parallel_memory_limit= @@global.parallel_memory_limit;
SET @save_pq_support_features_switch= @@pq_support_features_switch;
SET @save_transaction_isolation= @@transaction_isolation;
SET GLOBAL parallel_max_threads= 16;
SET GLOBAL parallel_memory_limit= 104857600;
SET pq_support_features_switch= 'simple_aggregate=on,count_distinct=on';
CREATE TABLE pq_cd_scalar_lifecycle (
id INT NOT NULL PRIMARY KEY,
shipdate DATE NOT NULL,
qty INT NULL
) ENGINE=InnoDB;
INSERT INTO pq_cd_scalar_lifecycle VALUES
(1, '1980-01-02', 10),
(2, '1980-01-03', 20),
(75, '1980-01-04', 10),
(76, '1980-01-05', 30),
(150, '1980-01-06', NULL),
(151, '1980-01-07', 20),
(152, '1979-12-31', 40);
CREATE TABLE pq_cd_group_lifecycle (
id INT NOT NULL PRIMARY KEY,
shipdate DATE NOT NULL,
returnflag CHAR(1) CHARACTER SET latin1 COLLATE latin1_bin NOT NULL,
linestatus CHAR(1) CHARACTER SET latin1 COLLATE latin1_bin NOT NULL,
qty INT NULL
) ENGINE=InnoDB;
INSERT INTO pq_cd_group_lifecycle VALUES
(1, '1998-09-01', 'A', 'F', 10),
(2, '1998-09-01', 'A', 'F', 20),
(75, '1998-09-01', 'A', 'F', 10),
(76, '1998-09-01', 'N', 'O', 30),
(150, '1998-09-01', 'A', 'F', NULL),
(151, '1998-09-01', 'N', 'O', 30),
(152, '1998-09-01', 'N', 'O', 40),
(153, '1998-09-03', 'R', 'F', 50);
#
# Scalar COUNT(DISTINCT) uses the statement snapshot after worker cloning.
#
connect  pq_cd_scalar_reader, localhost, root,,test;
connect  pq_cd_scalar_writer, localhost, root,,test;
connection pq_cd_scalar_reader;
SET SESSION TRANSACTION ISOLATION LEVEL READ COMMITTED;
SET pq_support_features_switch= 'simple_aggregate=on,count_distinct=on';
SET debug_sync= 'after_pq_create_snapshot SIGNAL pq_cd_scalar_snapshot WAIT_FOR pq_cd_scalar_release';
SELECT /*+ PQ(4) */ COUNT(DISTINCT qty) AS scalar_cd_snapshot_count FROM pq_cd_scalar_lifecycle WHERE shipdate > '1980-01-01';
connection pq_cd_scalar_writer;
SET debug_sync= 'now WAIT_FOR pq_cd_scalar_snapshot TIMEOUT 30';
INSERT INTO pq_cd_scalar_lifecycle VALUES (200, '1980-01-08', 40);
UPDATE pq_cd_scalar_lifecycle
SET shipdate= '1980-01-09', qty= 50
WHERE id= 152;
DELETE FROM pq_cd_scalar_lifecycle WHERE id= 1;
SET debug_sync= 'now SIGNAL pq_cd_scalar_release';
connection pq_cd_scalar_reader;
scalar_cd_snapshot_count
3
SHOW SESSION STATUS LIKE 'Parallel_query_count';
Variable_name	Value
Parallel_query_count	1
SET debug_sync= 'RESET';
disconnect pq_cd_scalar_reader;
connection pq_cd_scalar_writer;
SELECT COUNT(DISTINCT qty) AS scalar_cd_current_count
FROM pq_cd_scalar_lifecycle
WHERE shipdate > '1980-01-01';
scalar_cd_current_count
5
disconnect pq_cd_scalar_writer;
connection default;
SET debug_sync= 'RESET';
#
# Grouped COUNT(DISTINCT) uses the statement snapshot after worker cloning.
#
connect  pq_cd_group_reader, localhost, root,,test;
connect  pq_cd_group_writer, localhost, root,,test;
connection pq_cd_group_reader;
SET SESSION TRANSACTION ISOLATION LEVEL READ COMMITTED;
SET pq_support_features_switch= 'simple_aggregate=on,count_distinct=on';
SET debug_sync= 'after_pq_create_snapshot SIGNAL pq_cd_group_snapshot WAIT_FOR pq_cd_group_release';
SELECT /*+ PQ(4) */ returnflag, linestatus, COUNT(DISTINCT qty) AS grouped_cd_snapshot_count FROM pq_cd_group_lifecycle WHERE shipdate <= DATE '1998-09-02' GROUP BY returnflag, linestatus ORDER BY returnflag, linestatus;
connection pq_cd_group_writer;
SET debug_sync= 'now WAIT_FOR pq_cd_group_snapshot TIMEOUT 30';
INSERT INTO pq_cd_group_lifecycle VALUES (154, '1998-09-01', 'A', 'F', 60);
UPDATE pq_cd_group_lifecycle
SET shipdate= '1998-09-01', returnflag= 'N', linestatus= 'O', qty= 70
WHERE id= 153;
DELETE FROM pq_cd_group_lifecycle WHERE id= 1;
SET debug_sync= 'now SIGNAL pq_cd_group_release';
connection pq_cd_group_reader;
returnflag	linestatus	grouped_cd_snapshot_count
A	F	2
N	O	2
SHOW SESSION STATUS LIKE 'Parallel_query_count';
Variable_name	Value
Parallel_query_count	1
SET debug_sync= 'RESET';
disconnect pq_cd_group_reader;
connection pq_cd_group_writer;
SELECT returnflag, linestatus,
COUNT(DISTINCT qty) AS grouped_cd_current_count
FROM pq_cd_group_lifecycle
WHERE shipdate <= DATE '1998-09-02'
GROUP BY returnflag, linestatus
ORDER BY returnflag, linestatus;
returnflag	linestatus	grouped_cd_current_count
A	F	3
N	O	3
disconnect pq_cd_group_writer;
connection default;
SET debug_sync= 'RESET';
#
# Scalar COUNT(DISTINCT) releases resources after materialized-ready KILL.
#
connect  pq_cd_scalar_kill_leader, localhost, root,,test;
SET pq_support_features_switch= 'simple_aggregate=on,count_distinct=on';
SET debug_sync= 'after_pq_materialized_result_ready SIGNAL pq_cd_scalar_ready WAIT_FOR pq_cd_scalar_kill_release';
SELECT /*+ PQ(4) */ COUNT(DISTINCT qty) AS scalar_cd_killed_count FROM pq_cd_scalar_lifecycle WHERE shipdate > '1980-01-01';
connection default;
SET debug_sync= 'now WAIT_FOR pq_cd_scalar_ready TIMEOUT 30';
SET debug_sync= 'now SIGNAL pq_cd_scalar_kill_release';
connection pq_cd_scalar_kill_leader;
ERROR 70100: Query execution was interrupted
SHOW SESSION STATUS LIKE 'Parallel_query_count';
Variable_name	Value
Parallel_query_count	0
SET debug_sync= 'RESET';
disconnect pq_cd_scalar_kill_leader;
connection default;
SHOW GLOBAL STATUS LIKE 'PQ_threads_running';
Variable_name	Value
Pq_threads_running	0
SHOW GLOBAL STATUS LIKE 'PQ_memory_used';
Variable_name	Value
Pq_memory_used	0
SET debug_sync= 'RESET';
#
# Grouped COUNT(DISTINCT) releases resources after materialized-ready KILL.
#
connect  pq_cd_group_kill_leader, localhost, root,,test;
SET pq_support_features_switch= 'simple_aggregate=on,count_distinct=on';
SET debug_sync= 'after_pq_materialized_result_ready SIGNAL pq_cd_group_ready WAIT_FOR pq_cd_group_kill_release';
SELECT /*+ PQ(4) */ returnflag, linestatus, COUNT(DISTINCT qty) AS grouped_cd_killed_count FROM pq_cd_group_lifecycle WHERE shipdate <= DATE '1998-09-02' GROUP BY returnflag, linestatus ORDER BY returnflag, linestatus;
connection default;
SET debug_sync= 'now WAIT_FOR pq_cd_group_ready TIMEOUT 30';
SET debug_sync= 'now SIGNAL pq_cd_group_kill_release';
connection pq_cd_group_kill_leader;
ERROR 70100: Query execution was interrupted
SHOW SESSION STATUS LIKE 'Parallel_query_count';
Variable_name	Value
Parallel_query_count	0
SET debug_sync= 'RESET';
disconnect pq_cd_group_kill_leader;
connection default;
SHOW GLOBAL STATUS LIKE 'PQ_threads_running';
Variable_name	Value
Pq_threads_running	0
SHOW GLOBAL STATUS LIKE 'PQ_memory_used';
Variable_name	Value
Pq_memory_used	0
SET debug_sync= 'RESET';
SET GLOBAL parallel_max_threads= @save_parallel_max_threads;
SET GLOBAL parallel_memory_limit= @save_parallel_memory_limit;
SET pq_support_features_switch= @save_pq_support_features_switch;
SET SESSION transaction_isolation= @save_transaction_isolation;
DROP TABLE pq_cd_group_lifecycle;
DROP TABLE pq_cd_scalar_lifecycle;
