#
# MVCC, isolation, and locking boundaries for current PQ worker paths.
#
SET @save_transaction_isolation= @@transaction_isolation;
SET @save_parallel_memory_limit= @@global.parallel_memory_limit;
SET @save_debug_dbug= @@debug_dbug;
SET GLOBAL parallel_memory_limit= 104857600;
CREATE TABLE lineitem (
l_orderkey INT NOT NULL PRIMARY KEY,
l_shipdate DATE NOT NULL,
l_quantity INT NOT NULL
) ENGINE=InnoDB;
INSERT INTO lineitem VALUES
(1, '1979-12-31', 10),
(2, '1980-01-01', 20),
(3, '1980-01-02', 30),
(4, '1981-05-10', 40),
(5, '1992-07-15', 50),
(6, '1978-03-20', 60),
(7, '1980-06-01', 70),
(8, '1985-09-09', 80);
SET SESSION TRANSACTION ISOLATION LEVEL READ COMMITTED;
FLUSH STATUS;
SELECT /*+ PQ(4) */ COUNT(*) AS read_committed_count
FROM lineitem
WHERE l_shipdate > '1980-01-01';
read_committed_count
5
SHOW SESSION STATUS LIKE 'Parallel_query_count';
Variable_name	Value
Parallel_query_count	1
CREATE TABLE lineitem_mvcc_snapshot (
l_orderkey INT NOT NULL PRIMARY KEY,
l_shipdate DATE NOT NULL,
l_quantity INT NOT NULL
) ENGINE=InnoDB;
INSERT INTO lineitem_mvcc_snapshot VALUES
(1, '1980-01-02', 10),
(2, '1981-01-02', 20),
(3, '1979-01-02', 30);
connect  pq_mvcc_reader, localhost, root,,test;
connect  pq_mvcc_writer, localhost, root,,test;
connection pq_mvcc_reader;
SET SESSION TRANSACTION ISOLATION LEVEL REPEATABLE READ;
SET debug_sync= 'after_pq_create_snapshot SIGNAL pq_mvcc_rr_snapshot WAIT_FOR pq_mvcc_rr_release';
SELECT /*+ PQ(4) */ COUNT(*) AS mvcc_rr_count FROM lineitem_mvcc_snapshot WHERE l_shipdate > '1980-01-01';
connection pq_mvcc_writer;
SET debug_sync= 'now WAIT_FOR pq_mvcc_rr_snapshot TIMEOUT 30';
INSERT INTO lineitem_mvcc_snapshot VALUES (4, '1982-01-02', 40);
UPDATE lineitem_mvcc_snapshot SET l_shipdate= '1983-01-02' WHERE l_orderkey= 3;
DELETE FROM lineitem_mvcc_snapshot WHERE l_orderkey= 1;
SET debug_sync= 'now SIGNAL pq_mvcc_rr_release';
connection pq_mvcc_reader;
mvcc_rr_count
2
SHOW SESSION STATUS LIKE 'Parallel_query_count';
Variable_name	Value
Parallel_query_count	1
SET debug_sync= 'RESET';
connection pq_mvcc_writer;
SELECT COUNT(*) AS mvcc_current_count
FROM lineitem_mvcc_snapshot
WHERE l_shipdate > '1980-01-01';
mvcc_current_count
3
TRUNCATE TABLE lineitem_mvcc_snapshot;
INSERT INTO lineitem_mvcc_snapshot VALUES
(1, '1980-01-02', 10),
(2, '1981-01-02', 20),
(3, '1979-01-02', 30);
connection pq_mvcc_reader;
SET SESSION TRANSACTION ISOLATION LEVEL READ COMMITTED;
SET debug_sync= 'after_pq_create_snapshot SIGNAL pq_mvcc_rc_snapshot WAIT_FOR pq_mvcc_rc_release';
SELECT /*+ PQ(4) */ COUNT(*) AS mvcc_rc_count FROM lineitem_mvcc_snapshot WHERE l_shipdate > '1980-01-01';
connection pq_mvcc_writer;
SET debug_sync= 'now WAIT_FOR pq_mvcc_rc_snapshot TIMEOUT 30';
INSERT INTO lineitem_mvcc_snapshot VALUES (4, '1982-01-02', 40);
UPDATE lineitem_mvcc_snapshot SET l_shipdate= '1983-01-02' WHERE l_orderkey= 3;
DELETE FROM lineitem_mvcc_snapshot WHERE l_orderkey= 1;
SET debug_sync= 'now SIGNAL pq_mvcc_rc_release';
connection pq_mvcc_reader;
mvcc_rc_count
2
SHOW SESSION STATUS LIKE 'Parallel_query_count';
Variable_name	Value
Parallel_query_count	2
SET debug_sync= 'RESET';
disconnect pq_mvcc_reader;
connection pq_mvcc_writer;
SELECT COUNT(*) AS mvcc_current_count
FROM lineitem_mvcc_snapshot
WHERE l_shipdate > '1980-01-01';
mvcc_current_count
3
TRUNCATE TABLE lineitem_mvcc_snapshot;
INSERT INTO lineitem_mvcc_snapshot VALUES
(1, '1980-01-02', 10),
(2, '1981-01-02', 20),
(3, '1979-01-02', 30);
connect  pq_mvcc_rc_fallback_reader, localhost, root,,test;
connection pq_mvcc_rc_fallback_reader;
SET SESSION TRANSACTION ISOLATION LEVEL READ COMMITTED;
FLUSH STATUS;
SET debug_sync= 'after_pq_create_snapshot SIGNAL pq_mvcc_rc_memory_snapshot WAIT_FOR pq_mvcc_rc_memory_release';
SELECT /*+ PQ(4) */ COUNT(*) AS mvcc_rc_memory_fallback_count FROM lineitem_mvcc_snapshot WHERE l_shipdate > '1980-01-01';
connection pq_mvcc_writer;
SET debug_sync= 'now WAIT_FOR pq_mvcc_rc_memory_snapshot TIMEOUT 30';
INSERT INTO lineitem_mvcc_snapshot VALUES (4, '1982-01-02', 40);
UPDATE lineitem_mvcc_snapshot SET l_shipdate= '1983-01-02' WHERE l_orderkey= 3;
DELETE FROM lineitem_mvcc_snapshot WHERE l_orderkey= 1;
SET GLOBAL parallel_memory_limit= 0;
SET debug_sync= 'now SIGNAL pq_mvcc_rc_memory_release';
connection pq_mvcc_rc_fallback_reader;
mvcc_rc_memory_fallback_count
3
SHOW SESSION STATUS LIKE 'Parallel_query_count';
Variable_name	Value
Parallel_query_count	0
SET debug_sync= 'RESET';
disconnect pq_mvcc_rc_fallback_reader;
connection pq_mvcc_writer;
SELECT COUNT(*) AS mvcc_rc_memory_fallback_current_count
FROM lineitem_mvcc_snapshot
WHERE l_shipdate > '1980-01-01';
mvcc_rc_memory_fallback_current_count
3
SET GLOBAL parallel_memory_limit= 104857600;
TRUNCATE TABLE lineitem_mvcc_snapshot;
INSERT INTO lineitem_mvcc_snapshot VALUES
(1, '1980-01-02', 10),
(2, '1981-01-02', 20),
(3, '1979-01-02', 30);
connect  pq_mvcc_rc_worker_create_fallback_reader, localhost, root,,test;
connection pq_mvcc_rc_worker_create_fallback_reader;
SET SESSION TRANSACTION ISOLATION LEVEL READ COMMITTED;
SET SESSION debug_dbug= 'd,pq_fail_worker_create_first';
FLUSH STATUS;
SET debug_sync= 'after_pq_create_snapshot SIGNAL pq_mvcc_rc_worker_create_snapshot WAIT_FOR pq_mvcc_rc_worker_create_release';
SELECT /*+ PQ(4) */ COUNT(*) AS mvcc_rc_worker_create_fallback_count FROM lineitem_mvcc_snapshot WHERE l_shipdate > '1980-01-01';
connection pq_mvcc_writer;
SET debug_sync= 'now WAIT_FOR pq_mvcc_rc_worker_create_snapshot TIMEOUT 30';
INSERT INTO lineitem_mvcc_snapshot VALUES (4, '1982-01-02', 40);
UPDATE lineitem_mvcc_snapshot SET l_shipdate= '1983-01-02' WHERE l_orderkey= 3;
DELETE FROM lineitem_mvcc_snapshot WHERE l_orderkey= 1;
SET debug_sync= 'now SIGNAL pq_mvcc_rc_worker_create_release';
connection pq_mvcc_rc_worker_create_fallback_reader;
mvcc_rc_worker_create_fallback_count
3
SHOW SESSION STATUS LIKE 'Parallel_query_count';
Variable_name	Value
Parallel_query_count	0
SET SESSION debug_dbug= '';
SET debug_sync= 'RESET';
disconnect pq_mvcc_rc_worker_create_fallback_reader;
connection pq_mvcc_writer;
SELECT COUNT(*) AS mvcc_rc_worker_create_fallback_current_count
FROM lineitem_mvcc_snapshot
WHERE l_shipdate > '1980-01-01';
mvcc_rc_worker_create_fallback_current_count
3
SET debug_sync= 'RESET';
disconnect pq_mvcc_writer;
connection default;
SET debug_sync= 'RESET';
SET SESSION transaction_isolation= @save_transaction_isolation;
DROP TABLE lineitem_mvcc_snapshot;
CREATE TABLE lineitem_mvcc_projection (
l_orderkey INT NOT NULL PRIMARY KEY,
l_shipdate DATE NOT NULL,
l_quantity INT NOT NULL
) ENGINE=InnoDB;
CREATE TABLE lineitem_mvcc_q6 (
l_orderkey INT NOT NULL PRIMARY KEY,
l_shipdate DATE NOT NULL,
l_quantity DECIMAL(15,2) NOT NULL,
l_extendedprice DECIMAL(15,2) NOT NULL,
l_discount DECIMAL(15,2) NOT NULL
) ENGINE=InnoDB;
CREATE TABLE lineitem_mvcc_q1 (
l_orderkey INT NOT NULL PRIMARY KEY,
l_shipdate DATE NOT NULL,
l_returnflag CHAR(1) CHARACTER SET latin1 COLLATE latin1_bin NOT NULL,
l_linestatus CHAR(1) CHARACTER SET latin1 COLLATE latin1_bin NOT NULL,
l_quantity DECIMAL(15,2) NOT NULL,
l_extendedprice DECIMAL(15,2) NOT NULL,
l_discount DECIMAL(15,2) NOT NULL,
l_tax DECIMAL(15,2) NOT NULL
) ENGINE=InnoDB;
INSERT INTO lineitem_mvcc_projection VALUES
(1, '1980-01-02', 10),
(2, '1981-01-02', 20),
(3, '1979-01-02', 30);
INSERT INTO lineitem_mvcc_q6 VALUES
(1, '1994-01-01', 10.00, 100.00, 0.05),
(2, '1994-06-15', 20.00, 200.00, 0.06),
(3, '1993-01-01', 10.00, 400.00, 0.05);
INSERT INTO lineitem_mvcc_q1 VALUES
(1, '1998-09-01', 'A', 'F', 10.00, 100.00, 0.05, 0.10),
(2, '1998-09-02', 'N', 'O', 20.00, 200.00, 0.06, 0.08),
(3, '1998-09-03', 'A', 'F', 5.00, 50.00, 0.04, 0.02);
connect  pq_mvcc_reader2, localhost, root,,test;
connect  pq_mvcc_writer2, localhost, root,,test;
connection pq_mvcc_reader2;
SET SESSION TRANSACTION ISOLATION LEVEL REPEATABLE READ;
FLUSH STATUS;
SET debug_sync= 'after_pq_create_snapshot SIGNAL pq_mvcc_projection_rr_snapshot WAIT_FOR pq_mvcc_projection_rr_release';
SELECT /*+ PQ(4) */ l_orderkey, l_quantity FROM lineitem_mvcc_projection WHERE l_shipdate > '1980-01-01' ORDER BY l_orderkey;
connection pq_mvcc_writer2;
SET debug_sync= 'now WAIT_FOR pq_mvcc_projection_rr_snapshot TIMEOUT 30';
INSERT INTO lineitem_mvcc_projection VALUES (4, '1982-01-02', 40);
UPDATE lineitem_mvcc_projection SET l_shipdate= '1983-01-02' WHERE l_orderkey= 3;
DELETE FROM lineitem_mvcc_projection WHERE l_orderkey= 1;
SET debug_sync= 'now SIGNAL pq_mvcc_projection_rr_release';
connection pq_mvcc_reader2;
l_orderkey	l_quantity
1	10
2	20
SHOW SESSION STATUS LIKE 'Parallel_query_count';
Variable_name	Value
Parallel_query_count	1
SET debug_sync= 'RESET';
connection pq_mvcc_writer2;
SELECT l_orderkey, l_quantity AS mvcc_projection_current_quantity
FROM lineitem_mvcc_projection
WHERE l_shipdate > '1980-01-01'
ORDER BY l_orderkey;
l_orderkey	mvcc_projection_current_quantity
2	20
3	30
4	40
TRUNCATE TABLE lineitem_mvcc_projection;
INSERT INTO lineitem_mvcc_projection VALUES
(1, '1980-01-02', 10),
(2, '1981-01-02', 20),
(3, '1979-01-02', 30);
connection pq_mvcc_reader2;
SET SESSION TRANSACTION ISOLATION LEVEL READ COMMITTED;
FLUSH STATUS;
SET debug_sync= 'after_pq_create_snapshot SIGNAL pq_mvcc_projection_rc_snapshot WAIT_FOR pq_mvcc_projection_rc_release';
SELECT /*+ PQ(4) */ l_orderkey, l_quantity FROM lineitem_mvcc_projection WHERE l_shipdate > '1980-01-01' ORDER BY l_orderkey;
connection pq_mvcc_writer2;
SET debug_sync= 'now WAIT_FOR pq_mvcc_projection_rc_snapshot TIMEOUT 30';
INSERT INTO lineitem_mvcc_projection VALUES (4, '1982-01-02', 40);
UPDATE lineitem_mvcc_projection SET l_shipdate= '1983-01-02' WHERE l_orderkey= 3;
DELETE FROM lineitem_mvcc_projection WHERE l_orderkey= 1;
SET debug_sync= 'now SIGNAL pq_mvcc_projection_rc_release';
connection pq_mvcc_reader2;
l_orderkey	l_quantity
1	10
2	20
SHOW SESSION STATUS LIKE 'Parallel_query_count';
Variable_name	Value
Parallel_query_count	1
SET debug_sync= 'RESET';
connection pq_mvcc_writer2;
SELECT l_orderkey, l_quantity AS mvcc_projection_current_quantity
FROM lineitem_mvcc_projection
WHERE l_shipdate > '1980-01-01'
ORDER BY l_orderkey;
l_orderkey	mvcc_projection_current_quantity
2	20
3	30
4	40
connection pq_mvcc_reader2;
SET SESSION TRANSACTION ISOLATION LEVEL REPEATABLE READ;
FLUSH STATUS;
SET debug_sync= 'after_pq_create_snapshot SIGNAL pq_mvcc_q6_rr_snapshot WAIT_FOR pq_mvcc_q6_rr_release';
SELECT /*+ PQ(4) */ SUM(l_extendedprice * l_discount) AS mvcc_q6_rr_revenue FROM lineitem_mvcc_q6 WHERE l_shipdate >= DATE '1994-01-01' AND l_shipdate < DATE '1995-01-01' AND l_discount BETWEEN 0.05 AND 0.07 AND l_quantity < 24;
connection pq_mvcc_writer2;
SET debug_sync= 'now WAIT_FOR pq_mvcc_q6_rr_snapshot TIMEOUT 30';
INSERT INTO lineitem_mvcc_q6 VALUES (4, '1994-07-01', 10.00, 300.00, 0.07);
UPDATE lineitem_mvcc_q6 SET l_shipdate= '1994-03-01' WHERE l_orderkey= 3;
DELETE FROM lineitem_mvcc_q6 WHERE l_orderkey= 1;
SET debug_sync= 'now SIGNAL pq_mvcc_q6_rr_release';
connection pq_mvcc_reader2;
mvcc_q6_rr_revenue
17.0000
SHOW SESSION STATUS LIKE 'Parallel_query_count';
Variable_name	Value
Parallel_query_count	1
SET debug_sync= 'RESET';
connection pq_mvcc_writer2;
SELECT SUM(l_extendedprice * l_discount) AS mvcc_q6_current_revenue
FROM lineitem_mvcc_q6
WHERE l_shipdate >= DATE '1994-01-01'
  AND l_shipdate < DATE '1995-01-01'
  AND l_discount BETWEEN 0.05 AND 0.07
AND l_quantity < 24;
mvcc_q6_current_revenue
53.0000
include/assert.inc [Q6 RR current result reflects concurrent DML after PQ snapshot]
TRUNCATE TABLE lineitem_mvcc_q6;
INSERT INTO lineitem_mvcc_q6 VALUES
(1, '1994-01-01', 10.00, 100.00, 0.05),
(2, '1994-06-15', 20.00, 200.00, 0.06),
(3, '1993-01-01', 10.00, 400.00, 0.05);
connection pq_mvcc_reader2;
SET SESSION TRANSACTION ISOLATION LEVEL READ COMMITTED;
FLUSH STATUS;
SET debug_sync= 'after_pq_create_snapshot SIGNAL pq_mvcc_q6_rc_snapshot WAIT_FOR pq_mvcc_q6_rc_release';
SELECT /*+ PQ(4) */ SUM(l_extendedprice * l_discount) AS mvcc_q6_rc_revenue FROM lineitem_mvcc_q6 WHERE l_shipdate >= DATE '1994-01-01' AND l_shipdate < DATE '1995-01-01' AND l_discount BETWEEN 0.05 AND 0.07 AND l_quantity < 24;
connection pq_mvcc_writer2;
SET debug_sync= 'now WAIT_FOR pq_mvcc_q6_rc_snapshot TIMEOUT 30';
INSERT INTO lineitem_mvcc_q6 VALUES (4, '1994-07-01', 10.00, 300.00, 0.07);
UPDATE lineitem_mvcc_q6 SET l_shipdate= '1994-03-01' WHERE l_orderkey= 3;
DELETE FROM lineitem_mvcc_q6 WHERE l_orderkey= 1;
SET debug_sync= 'now SIGNAL pq_mvcc_q6_rc_release';
connection pq_mvcc_reader2;
mvcc_q6_rc_revenue
17.0000
SHOW SESSION STATUS LIKE 'Parallel_query_count';
Variable_name	Value
Parallel_query_count	1
SET debug_sync= 'RESET';
connection pq_mvcc_writer2;
SELECT SUM(l_extendedprice * l_discount) AS mvcc_q6_current_revenue
FROM lineitem_mvcc_q6
WHERE l_shipdate >= DATE '1994-01-01'
  AND l_shipdate < DATE '1995-01-01'
  AND l_discount BETWEEN 0.05 AND 0.07
AND l_quantity < 24;
mvcc_q6_current_revenue
53.0000
include/assert.inc [Q6 RC current result reflects concurrent DML after PQ snapshot]
connection pq_mvcc_reader2;
SET SESSION TRANSACTION ISOLATION LEVEL REPEATABLE READ;
FLUSH STATUS;
SET debug_sync= 'after_pq_create_snapshot SIGNAL pq_mvcc_q1_rr_snapshot WAIT_FOR pq_mvcc_q1_rr_release';
SELECT /*+ PQ(4) */ l_returnflag, l_linestatus, SUM(l_quantity) AS sum_qty, SUM(l_extendedprice) AS sum_base_price, SUM(l_extendedprice * (1 - l_discount)) AS sum_disc_price, SUM(l_extendedprice * (1 - l_discount) * (1 + l_tax)) AS sum_charge, AVG(l_quantity) AS avg_qty, AVG(l_extendedprice) AS avg_price, AVG(l_discount) AS avg_disc, COUNT(*) AS count_order FROM lineitem_mvcc_q1 WHERE l_shipdate <= DATE '1998-09-02' GROUP BY l_returnflag, l_linestatus ORDER BY l_returnflag, l_linestatus;
connection pq_mvcc_writer2;
SET debug_sync= 'now WAIT_FOR pq_mvcc_q1_rr_snapshot TIMEOUT 30';
INSERT INTO lineitem_mvcc_q1 VALUES (4, '1998-09-01', 'R', 'F', 30.00, 300.00, 0.07, 0.05);
UPDATE lineitem_mvcc_q1 SET l_shipdate= '1998-09-01' WHERE l_orderkey= 3;
DELETE FROM lineitem_mvcc_q1 WHERE l_orderkey= 1;
SET debug_sync= 'now SIGNAL pq_mvcc_q1_rr_release';
connection pq_mvcc_reader2;
l_returnflag	l_linestatus	sum_qty	sum_base_price	sum_disc_price	sum_charge	avg_qty	avg_price	avg_disc	count_order
A	F	10.00	100.00	95.0000	104.500000	10.000000	100.000000	0.050000	1
N	O	20.00	200.00	188.0000	203.040000	20.000000	200.000000	0.060000	1
SHOW SESSION STATUS LIKE 'Parallel_query_count';
Variable_name	Value
Parallel_query_count	1
SET debug_sync= 'RESET';
connection pq_mvcc_writer2;
SELECT l_returnflag, l_linestatus,
SUM(l_quantity) AS mvcc_q1_current_sum_qty,
SUM(l_extendedprice) AS mvcc_q1_current_sum_base_price,
SUM(l_extendedprice * (1 - l_discount)) AS mvcc_q1_current_sum_disc_price,
SUM(l_extendedprice * (1 - l_discount) * (1 + l_tax)) AS mvcc_q1_current_sum_charge,
AVG(l_quantity) AS mvcc_q1_current_avg_qty,
AVG(l_extendedprice) AS mvcc_q1_current_avg_price,
AVG(l_discount) AS mvcc_q1_current_avg_disc,
COUNT(*) AS mvcc_q1_current_count
FROM lineitem_mvcc_q1
WHERE l_shipdate <= DATE '1998-09-02'
GROUP BY l_returnflag, l_linestatus
ORDER BY l_returnflag, l_linestatus;
l_returnflag	l_linestatus	mvcc_q1_current_sum_qty	mvcc_q1_current_sum_base_price	mvcc_q1_current_sum_disc_price	mvcc_q1_current_sum_charge	mvcc_q1_current_avg_qty	mvcc_q1_current_avg_price	mvcc_q1_current_avg_disc	mvcc_q1_current_count
A	F	5.00	50.00	48.0000	48.960000	5.000000	50.000000	0.040000	1
N	O	20.00	200.00	188.0000	203.040000	20.000000	200.000000	0.060000	1
R	F	30.00	300.00	279.0000	292.950000	30.000000	300.000000	0.070000	1
include/assert.inc [Q1 RR current grouped result reflects concurrent DML after PQ snapshot]
TRUNCATE TABLE lineitem_mvcc_q1;
INSERT INTO lineitem_mvcc_q1 VALUES
(1, '1998-09-01', 'A', 'F', 10.00, 100.00, 0.05, 0.10),
(2, '1998-09-02', 'N', 'O', 20.00, 200.00, 0.06, 0.08),
(3, '1998-09-03', 'A', 'F', 5.00, 50.00, 0.04, 0.02);
connection pq_mvcc_reader2;
SET SESSION TRANSACTION ISOLATION LEVEL READ COMMITTED;
FLUSH STATUS;
SET debug_sync= 'after_pq_create_snapshot SIGNAL pq_mvcc_q1_rc_snapshot WAIT_FOR pq_mvcc_q1_rc_release';
SELECT /*+ PQ(4) */ l_returnflag, l_linestatus, SUM(l_quantity) AS sum_qty, SUM(l_extendedprice) AS sum_base_price, SUM(l_extendedprice * (1 - l_discount)) AS sum_disc_price, SUM(l_extendedprice * (1 - l_discount) * (1 + l_tax)) AS sum_charge, AVG(l_quantity) AS avg_qty, AVG(l_extendedprice) AS avg_price, AVG(l_discount) AS avg_disc, COUNT(*) AS count_order FROM lineitem_mvcc_q1 WHERE l_shipdate <= DATE '1998-09-02' GROUP BY l_returnflag, l_linestatus ORDER BY l_returnflag, l_linestatus;
connection pq_mvcc_writer2;
SET debug_sync= 'now WAIT_FOR pq_mvcc_q1_rc_snapshot TIMEOUT 30';
INSERT INTO lineitem_mvcc_q1 VALUES (4, '1998-09-01', 'R', 'F', 30.00, 300.00, 0.07, 0.05);
UPDATE lineitem_mvcc_q1 SET l_shipdate= '1998-09-01' WHERE l_orderkey= 3;
DELETE FROM lineitem_mvcc_q1 WHERE l_orderkey= 1;
SET debug_sync= 'now SIGNAL pq_mvcc_q1_rc_release';
connection pq_mvcc_reader2;
l_returnflag	l_linestatus	sum_qty	sum_base_price	sum_disc_price	sum_charge	avg_qty	avg_price	avg_disc	count_order
A	F	10.00	100.00	95.0000	104.500000	10.000000	100.000000	0.050000	1
N	O	20.00	200.00	188.0000	203.040000	20.000000	200.000000	0.060000	1
SHOW SESSION STATUS LIKE 'Parallel_query_count';
Variable_name	Value
Parallel_query_count	1
SET debug_sync= 'RESET';
disconnect pq_mvcc_reader2;
connection pq_mvcc_writer2;
SELECT l_returnflag, l_linestatus,
SUM(l_quantity) AS mvcc_q1_current_sum_qty,
SUM(l_extendedprice) AS mvcc_q1_current_sum_base_price,
SUM(l_extendedprice * (1 - l_discount)) AS mvcc_q1_current_sum_disc_price,
SUM(l_extendedprice * (1 - l_discount) * (1 + l_tax)) AS mvcc_q1_current_sum_charge,
AVG(l_quantity) AS mvcc_q1_current_avg_qty,
AVG(l_extendedprice) AS mvcc_q1_current_avg_price,
AVG(l_discount) AS mvcc_q1_current_avg_disc,
COUNT(*) AS mvcc_q1_current_count
FROM lineitem_mvcc_q1
WHERE l_shipdate <= DATE '1998-09-02'
GROUP BY l_returnflag, l_linestatus
ORDER BY l_returnflag, l_linestatus;
l_returnflag	l_linestatus	mvcc_q1_current_sum_qty	mvcc_q1_current_sum_base_price	mvcc_q1_current_sum_disc_price	mvcc_q1_current_sum_charge	mvcc_q1_current_avg_qty	mvcc_q1_current_avg_price	mvcc_q1_current_avg_disc	mvcc_q1_current_count
A	F	5.00	50.00	48.0000	48.960000	5.000000	50.000000	0.040000	1
N	O	20.00	200.00	188.0000	203.040000	20.000000	200.000000	0.060000	1
R	F	30.00	300.00	279.0000	292.950000	30.000000	300.000000	0.070000	1
include/assert.inc [Q1 RC current grouped result reflects concurrent DML after PQ snapshot]
SET debug_sync= 'RESET';
disconnect pq_mvcc_writer2;
connection default;
SET debug_sync= 'RESET';
SET SESSION transaction_isolation= @save_transaction_isolation;
DROP TABLE lineitem_mvcc_projection;
DROP TABLE lineitem_mvcc_q6;
DROP TABLE lineitem_mvcc_q1;
CREATE TABLE lineitem_partitioned_mvcc (
l_orderkey INT NOT NULL PRIMARY KEY,
l_shipdate DATE NOT NULL,
l_returnflag CHAR(1) CHARACTER SET latin1 COLLATE latin1_bin NOT NULL,
l_linestatus CHAR(1) CHARACTER SET latin1 COLLATE latin1_bin NOT NULL,
l_quantity DECIMAL(15,2) NOT NULL,
l_extendedprice DECIMAL(15,2) NOT NULL,
l_discount DECIMAL(15,2) NOT NULL,
l_tax DECIMAL(15,2) NOT NULL
) ENGINE=InnoDB
PARTITION BY HASH(l_orderkey) PARTITIONS 2;
INSERT INTO lineitem_partitioned_mvcc VALUES
(1, '1994-01-01', 'A', 'F', 10.00, 100.00, 0.05, 0.10),
(2, '1994-06-15', 'N', 'O', 20.00, 200.00, 0.06, 0.08),
(3, '1993-01-01', 'A', 'F', 5.00, 50.00, 0.04, 0.02);
connect  pq_partition_mvcc_reader, localhost, root,,test;
connect  pq_partition_mvcc_writer, localhost, root,,test;
connection pq_partition_mvcc_reader;
SET SESSION TRANSACTION ISOLATION LEVEL READ COMMITTED;
FLUSH STATUS;
SET debug_sync= 'after_pq_create_snapshot SIGNAL pq_partition_mvcc_q6_snapshot WAIT_FOR pq_partition_mvcc_q6_release';
SELECT /*+ PQ(4) */ SUM(l_extendedprice * l_discount) AS partition_mvcc_q6_revenue FROM lineitem_partitioned_mvcc WHERE l_shipdate >= DATE '1994-01-01' AND l_shipdate < DATE '1995-01-01' AND l_discount BETWEEN 0.05 AND 0.07 AND l_quantity < 24;
connection pq_partition_mvcc_writer;
SET debug_sync= 'now WAIT_FOR pq_partition_mvcc_q6_snapshot TIMEOUT 30';
INSERT INTO lineitem_partitioned_mvcc VALUES
(4, '1994-07-01', 'R', 'F', 10.00, 300.00, 0.07, 0.05);
UPDATE lineitem_partitioned_mvcc
SET l_shipdate= '1994-03-01',
l_quantity= 10.00,
l_extendedprice= 400.00,
l_discount= 0.05
WHERE l_orderkey= 3;
DELETE FROM lineitem_partitioned_mvcc WHERE l_orderkey= 1;
SET debug_sync= 'now SIGNAL pq_partition_mvcc_q6_release';
connection pq_partition_mvcc_reader;
partition_mvcc_q6_revenue
17.0000
SHOW SESSION STATUS LIKE 'Parallel_query_count';
Variable_name	Value
Parallel_query_count	1
SET debug_sync= 'RESET';
connection pq_partition_mvcc_writer;
SELECT SUM(l_extendedprice * l_discount) AS partition_mvcc_q6_current_revenue
FROM lineitem_partitioned_mvcc
WHERE l_shipdate >= DATE '1994-01-01'
  AND l_shipdate < DATE '1995-01-01'
  AND l_discount BETWEEN 0.05 AND 0.07
AND l_quantity < 24;
partition_mvcc_q6_current_revenue
53.0000
TRUNCATE TABLE lineitem_partitioned_mvcc;
INSERT INTO lineitem_partitioned_mvcc VALUES
(1, '1994-01-01', 'A', 'F', 10.00, 100.00, 0.05, 0.10),
(2, '1994-06-15', 'N', 'O', 20.00, 200.00, 0.06, 0.08),
(3, '1993-01-01', 'A', 'F', 5.00, 50.00, 0.04, 0.02);
connection pq_partition_mvcc_reader;
SET SESSION TRANSACTION ISOLATION LEVEL REPEATABLE READ;
FLUSH STATUS;
SET debug_sync= 'after_pq_create_snapshot SIGNAL pq_partition_mvcc_q6_rr_snapshot WAIT_FOR pq_partition_mvcc_q6_rr_release';
SELECT /*+ PQ(4) */ SUM(l_extendedprice * l_discount) AS partition_mvcc_q6_rr_revenue FROM lineitem_partitioned_mvcc WHERE l_shipdate >= DATE '1994-01-01' AND l_shipdate < DATE '1995-01-01' AND l_discount BETWEEN 0.05 AND 0.07 AND l_quantity < 24;
connection pq_partition_mvcc_writer;
SET debug_sync= 'now WAIT_FOR pq_partition_mvcc_q6_rr_snapshot TIMEOUT 30';
INSERT INTO lineitem_partitioned_mvcc VALUES
(4, '1994-07-01', 'R', 'F', 10.00, 300.00, 0.07, 0.05);
UPDATE lineitem_partitioned_mvcc
SET l_shipdate= '1994-03-01',
l_quantity= 10.00,
l_extendedprice= 400.00,
l_discount= 0.05
WHERE l_orderkey= 3;
DELETE FROM lineitem_partitioned_mvcc WHERE l_orderkey= 1;
SET debug_sync= 'now SIGNAL pq_partition_mvcc_q6_rr_release';
connection pq_partition_mvcc_reader;
partition_mvcc_q6_rr_revenue
17.0000
SHOW SESSION STATUS LIKE 'Parallel_query_count';
Variable_name	Value
Parallel_query_count	1
SET debug_sync= 'RESET';
connection pq_partition_mvcc_writer;
SELECT SUM(l_extendedprice * l_discount) AS partition_mvcc_q6_rr_current_revenue
FROM lineitem_partitioned_mvcc
WHERE l_shipdate >= DATE '1994-01-01'
  AND l_shipdate < DATE '1995-01-01'
  AND l_discount BETWEEN 0.05 AND 0.07
AND l_quantity < 24;
partition_mvcc_q6_rr_current_revenue
53.0000
TRUNCATE TABLE lineitem_partitioned_mvcc;
INSERT INTO lineitem_partitioned_mvcc VALUES
(1, '1994-01-01', 'A', 'F', 10.00, 100.00, 0.05, 0.10),
(2, '1994-06-15', 'N', 'O', 20.00, 200.00, 0.06, 0.08),
(3, '1993-01-01', 'A', 'F', 5.00, 50.00, 0.04, 0.02);
connection pq_partition_mvcc_reader;
SET SESSION TRANSACTION ISOLATION LEVEL REPEATABLE READ;
FLUSH STATUS;
SET debug_sync= 'after_pq_create_snapshot SIGNAL pq_partition_mvcc_q1_snapshot WAIT_FOR pq_partition_mvcc_q1_release';
SELECT /*+ PQ(4) */ l_returnflag, l_linestatus, SUM(l_quantity) AS partition_mvcc_q1_sum_qty, SUM(l_extendedprice) AS partition_mvcc_q1_sum_base_price, SUM(l_extendedprice * (1 - l_discount)) AS partition_mvcc_q1_sum_disc_price, SUM(l_extendedprice * (1 - l_discount) * (1 + l_tax)) AS partition_mvcc_q1_sum_charge, AVG(l_quantity) AS partition_mvcc_q1_avg_qty, AVG(l_extendedprice) AS partition_mvcc_q1_avg_price, AVG(l_discount) AS partition_mvcc_q1_avg_disc, COUNT(*) AS partition_mvcc_q1_count FROM lineitem_partitioned_mvcc WHERE l_shipdate <= DATE '1998-09-02' GROUP BY l_returnflag, l_linestatus ORDER BY l_returnflag, l_linestatus;
connection pq_partition_mvcc_writer;
SET debug_sync= 'now WAIT_FOR pq_partition_mvcc_q1_snapshot TIMEOUT 30';
INSERT INTO lineitem_partitioned_mvcc VALUES
(4, '1998-09-01', 'R', 'F', 30.00, 300.00, 0.07, 0.05);
UPDATE lineitem_partitioned_mvcc
SET l_returnflag= 'N',
l_linestatus= 'O'
WHERE l_orderkey= 3;
DELETE FROM lineitem_partitioned_mvcc WHERE l_orderkey= 1;
SET debug_sync= 'now SIGNAL pq_partition_mvcc_q1_release';
connection pq_partition_mvcc_reader;
l_returnflag	l_linestatus	partition_mvcc_q1_sum_qty	partition_mvcc_q1_sum_base_price	partition_mvcc_q1_sum_disc_price	partition_mvcc_q1_sum_charge	partition_mvcc_q1_avg_qty	partition_mvcc_q1_avg_price	partition_mvcc_q1_avg_disc	partition_mvcc_q1_count
A	F	15.00	150.00	143.0000	153.460000	7.500000	75.000000	0.045000	2
N	O	20.00	200.00	188.0000	203.040000	20.000000	200.000000	0.060000	1
SHOW SESSION STATUS LIKE 'Parallel_query_count';
Variable_name	Value
Parallel_query_count	1
SET debug_sync= 'RESET';
connection pq_partition_mvcc_writer;
SELECT l_returnflag, l_linestatus,
SUM(l_quantity) AS partition_mvcc_q1_current_sum_qty,
SUM(l_extendedprice) AS partition_mvcc_q1_current_sum_base_price,
SUM(l_extendedprice * (1 - l_discount)) AS partition_mvcc_q1_current_sum_disc_price,
SUM(l_extendedprice * (1 - l_discount) * (1 + l_tax)) AS partition_mvcc_q1_current_sum_charge,
AVG(l_quantity) AS partition_mvcc_q1_current_avg_qty,
AVG(l_extendedprice) AS partition_mvcc_q1_current_avg_price,
AVG(l_discount) AS partition_mvcc_q1_current_avg_disc,
COUNT(*) AS partition_mvcc_q1_current_count
FROM lineitem_partitioned_mvcc
WHERE l_shipdate <= DATE '1998-09-02'
GROUP BY l_returnflag, l_linestatus
ORDER BY l_returnflag, l_linestatus;
l_returnflag	l_linestatus	partition_mvcc_q1_current_sum_qty	partition_mvcc_q1_current_sum_base_price	partition_mvcc_q1_current_sum_disc_price	partition_mvcc_q1_current_sum_charge	partition_mvcc_q1_current_avg_qty	partition_mvcc_q1_current_avg_price	partition_mvcc_q1_current_avg_disc	partition_mvcc_q1_current_count
N	O	25.00	250.00	236.0000	252.000000	12.500000	125.000000	0.050000	2
R	F	30.00	300.00	279.0000	292.950000	30.000000	300.000000	0.070000	1
TRUNCATE TABLE lineitem_partitioned_mvcc;
INSERT INTO lineitem_partitioned_mvcc VALUES
(1, '1994-01-01', 'A', 'F', 10.00, 100.00, 0.05, 0.10),
(2, '1994-06-15', 'N', 'O', 20.00, 200.00, 0.06, 0.08),
(3, '1993-01-01', 'A', 'F', 5.00, 50.00, 0.04, 0.02);
connection pq_partition_mvcc_reader;
SET SESSION TRANSACTION ISOLATION LEVEL READ COMMITTED;
FLUSH STATUS;
SET debug_sync= 'after_pq_create_snapshot SIGNAL pq_partition_mvcc_q1_rc_snapshot WAIT_FOR pq_partition_mvcc_q1_rc_release';
SELECT /*+ PQ(4) */ l_returnflag, l_linestatus, SUM(l_quantity) AS partition_mvcc_q1_rc_sum_qty, SUM(l_extendedprice) AS partition_mvcc_q1_rc_sum_base_price, SUM(l_extendedprice * (1 - l_discount)) AS partition_mvcc_q1_rc_sum_disc_price, SUM(l_extendedprice * (1 - l_discount) * (1 + l_tax)) AS partition_mvcc_q1_rc_sum_charge, AVG(l_quantity) AS partition_mvcc_q1_rc_avg_qty, AVG(l_extendedprice) AS partition_mvcc_q1_rc_avg_price, AVG(l_discount) AS partition_mvcc_q1_rc_avg_disc, COUNT(*) AS partition_mvcc_q1_rc_count FROM lineitem_partitioned_mvcc WHERE l_shipdate <= DATE '1998-09-02' GROUP BY l_returnflag, l_linestatus ORDER BY l_returnflag, l_linestatus;
connection pq_partition_mvcc_writer;
SET debug_sync= 'now WAIT_FOR pq_partition_mvcc_q1_rc_snapshot TIMEOUT 30';
INSERT INTO lineitem_partitioned_mvcc VALUES
(4, '1998-09-01', 'R', 'F', 30.00, 300.00, 0.07, 0.05);
UPDATE lineitem_partitioned_mvcc
SET l_returnflag= 'N',
l_linestatus= 'O'
WHERE l_orderkey= 3;
DELETE FROM lineitem_partitioned_mvcc WHERE l_orderkey= 1;
SET debug_sync= 'now SIGNAL pq_partition_mvcc_q1_rc_release';
connection pq_partition_mvcc_reader;
l_returnflag	l_linestatus	partition_mvcc_q1_rc_sum_qty	partition_mvcc_q1_rc_sum_base_price	partition_mvcc_q1_rc_sum_disc_price	partition_mvcc_q1_rc_sum_charge	partition_mvcc_q1_rc_avg_qty	partition_mvcc_q1_rc_avg_price	partition_mvcc_q1_rc_avg_disc	partition_mvcc_q1_rc_count
A	F	15.00	150.00	143.0000	153.460000	7.500000	75.000000	0.045000	2
N	O	20.00	200.00	188.0000	203.040000	20.000000	200.000000	0.060000	1
SHOW SESSION STATUS LIKE 'Parallel_query_count';
Variable_name	Value
Parallel_query_count	1
SET debug_sync= 'RESET';
disconnect pq_partition_mvcc_reader;
connection pq_partition_mvcc_writer;
SELECT l_returnflag, l_linestatus,
SUM(l_quantity) AS partition_mvcc_q1_rc_current_sum_qty,
SUM(l_extendedprice) AS partition_mvcc_q1_rc_current_sum_base_price,
SUM(l_extendedprice * (1 - l_discount)) AS partition_mvcc_q1_rc_current_sum_disc_price,
SUM(l_extendedprice * (1 - l_discount) * (1 + l_tax)) AS partition_mvcc_q1_rc_current_sum_charge,
AVG(l_quantity) AS partition_mvcc_q1_rc_current_avg_qty,
AVG(l_extendedprice) AS partition_mvcc_q1_rc_current_avg_price,
AVG(l_discount) AS partition_mvcc_q1_rc_current_avg_disc,
COUNT(*) AS partition_mvcc_q1_rc_current_count
FROM lineitem_partitioned_mvcc
WHERE l_shipdate <= DATE '1998-09-02'
GROUP BY l_returnflag, l_linestatus
ORDER BY l_returnflag, l_linestatus;
l_returnflag	l_linestatus	partition_mvcc_q1_rc_current_sum_qty	partition_mvcc_q1_rc_current_sum_base_price	partition_mvcc_q1_rc_current_sum_disc_price	partition_mvcc_q1_rc_current_sum_charge	partition_mvcc_q1_rc_current_avg_qty	partition_mvcc_q1_rc_current_avg_price	partition_mvcc_q1_rc_current_avg_disc	partition_mvcc_q1_rc_current_count
N	O	25.00	250.00	236.0000	252.000000	12.500000	125.000000	0.050000	2
R	F	30.00	300.00	279.0000	292.950000	30.000000	300.000000	0.070000	1
SET debug_sync= 'RESET';
disconnect pq_partition_mvcc_writer;
connection default;
SET debug_sync= 'RESET';
DROP TABLE lineitem_partitioned_mvcc;
SET SESSION TRANSACTION ISOLATION LEVEL READ UNCOMMITTED;
FLUSH STATUS;
SELECT /*+ PQ(4) */ COUNT(*) AS read_uncommitted_count
FROM lineitem
WHERE l_shipdate > '1980-01-01';
read_uncommitted_count
5
SHOW SESSION STATUS LIKE 'Parallel_query_count';
Variable_name	Value
Parallel_query_count	0
SET SESSION TRANSACTION ISOLATION LEVEL SERIALIZABLE;
FLUSH STATUS;
SELECT /*+ PQ(4) */ COUNT(*) AS serializable_count
FROM lineitem
WHERE l_shipdate > '1980-01-01';
serializable_count
5
SHOW SESSION STATUS LIKE 'Parallel_query_count';
Variable_name	Value
Parallel_query_count	0
SET SESSION transaction_isolation= @save_transaction_isolation;
FLUSH STATUS;
SELECT /*+ PQ(4) */ l_orderkey
FROM lineitem
WHERE l_shipdate > '1980-01-01'
ORDER BY l_orderkey
FOR UPDATE;
l_orderkey
3
4
5
7
8
SHOW SESSION STATUS LIKE 'Parallel_query_count';
Variable_name	Value
Parallel_query_count	0
FLUSH STATUS;
START TRANSACTION;
INSERT INTO lineitem VALUES (9, '1988-08-08', 90);
SELECT /*+ PQ(4) */ COUNT(*) AS transaction_count
FROM lineitem
WHERE l_shipdate > '1980-01-01';
transaction_count
6
SHOW SESSION STATUS LIKE 'Parallel_query_count';
Variable_name	Value
Parallel_query_count	0
ROLLBACK;
SET SESSION transaction_isolation= @save_transaction_isolation;
SET SESSION debug_dbug= @save_debug_dbug;
SET GLOBAL parallel_memory_limit= @save_parallel_memory_limit;
SET debug_sync= 'RESET';
DROP TABLE lineitem;
